{
  "schemaVersion": 1,
  "generatedAt": "2026-08-03T19:24:59.076Z",
  "deno": {
    "installed": "2.6.10",
    "required": "2.6.10"
  },
  "total": 30,
  "passed": 23,
  "failed": 7,
  "results": [
    {
      "name": "auth-email-hook",
      "ok": true,
      "durationMs": 10247,
      "checks": [
        {
          "entrypoint": "index.ts",
          "path": "/dev-server/supabase/functions/auth-email-hook/index.ts",
          "findings": [],
          "ok": true,
          "durationMs": 10247,
          "stdout": "",
          "stderr": "\u001b[0m\u001b[32mDownload\u001b[0m https://europe-west1-npm.pkg.dev/lovable-core-prod/sandbox-npm-cache/@react-email%2fcomponents\n\u001b[0m\u001b[32mDownload\u001b[0m https://europe-west1-npm.pkg.dev/lovable-core-prod/sandbox-npm-cache/@lovable.dev%2femail-js\n\u001b[0m\u001b[32mDownload\u001b[0m https://europe-west1-npm.pkg.dev/lovable-core-prod/sandbox-npm-cache/@lovable.dev%2fwebhooks-js\n\u001b[0m\u001b[32mDownload\u001b[0m https://europe-west1-npm.pkg.dev/lovable-core-prod/sandbox-npm-cache/@react-email%2fbody\n\u001b[0m\u001b[32mDownload\u001b[0m https://europe-west1-npm.pkg.dev/lovable-core-prod/sandbox-npm-cache/@react-email%2fbutton\n\u001b[0m\u001b[32mDownload\u001b[0m https://europe-west1-npm.pkg.dev/lovable-core-prod/sandbox-npm-cache/@react-email%2fcode-block\n\u001b[0m\u001b[32mDownload\u001b[0m https://europe-west1-npm.pkg.dev/lovable-core-prod/sandbox-npm-cache/@react-email%2fcode-inline\n\u001b[0m\u001b[32mDownload\u001b[0m https://europe-west1-npm.pkg.dev/lovable-core-prod/sandbox-npm-cache/@react-email%2fcolumn\n\u001b[0m\u001b[32mDownload\u001b[0m https://europe-west1-npm.pkg.dev/lovable-core-prod/sandbox-npm-cache/@react-email%2fcontainer\n\u001b[0m\u001b[32mDownload\u001b[0m https://europe-west1-npm.pkg.dev/lovable-core-prod/sandbox-npm-cache/@react-email%2ffont\n\u001b[0m\u001b[32mDownload\u001b[0m https://europe-west1-npm.pkg.dev/lovable-core-prod/sandbox-npm-cache/@react-email%2fhead\n\u001b[0m\u001b[32mDownload\u001b[0m https://europe-west1-npm.pkg.dev/lovable-core-prod/sandbox-npm-cache/@react-email%2fheading\n\u001b[0m\u001b[32mDownload\u001b[0m https://europe-west1-npm.pkg.dev/lovable-core-prod/sandbox-npm-cache/@react-email%2fhr\n\u001b[0m\u001b[32mDownload\u001b[0m https://europe-west1-npm.pkg.dev/lovable-core-prod/sandbox-npm-cache/@react-email%2fhtml\n\u001b[0m\u001b[32mDownload\u001b[0m https://europe-west1-npm.pkg.dev/lovable-core-prod/sandbox-npm-cache/@react-email%2fimg\n\u001b[0m\u001b[32mDownload\u001b[0m https://europe-west1-npm.pkg.dev/lovable-core-prod/sandbox-npm-cache/@react-email%2flink\n\u001b[0m\u001b[32mDownload\u001b[0m https://europe-west1-npm.pkg.dev/lovable-core-prod/sandbox-npm-cache/@react-email%2fmarkdown\n\u001b[0m\u001b[32mDownload\u001b[0m https://europe-west1-npm.pkg.dev/lovable-core-prod/sandbox-npm-cache/@react-email%2fpreview\n\u001b[0m\u001b[32mDownload\u001b[0m https://europe-west1-npm.pkg.dev/lovable-core-prod/sandbox-npm-cache/@react-email%2frender\n\u001b[0m\u001b[32mDownload\u001b[0m https://europe-west1-npm.pkg.dev/lovable-core-prod/sandbox-npm-cache/@react-email%2frow\n\u001b[0m\u001b[32mDownload\u001b[0m https://europe-west1-npm.pkg.dev/lovable-core-prod/sandbox-npm-cache/@react-email%2fsection\n\u001b[0m\u001b[32mDownload\u001b[0m https://europe-west1-npm.pkg.dev/lovable-core-prod/sandbox-npm-cache/@react-email%2ftailwind\n\u001b[0m\u001b[32mDownload\u001b[0m https://europe-west1-npm.pkg.dev/lovable-core-prod/sandbox-npm-cache/@react-email%2ftext\n\u001b[0m\u001b[32mDownload\u001b[0m https://europe-west1-npm.pkg.dev/lovable-core-prod/sandbox-npm-cache/prismjs\n\u001b[0m\u001b[32mDownload\u001b[0m https://europe-west1-npm.pkg.dev/lovable-core-prod/sandbox-npm-cache/md-to-react-email\n\u001b[0m\u001b[32mDownload\u001b[0m https://europe-west1-npm.pkg.dev/lovable-core-prod/sandbox-npm-cache/html-to-text\n\u001b[0m\u001b[32mDownload\u001b[0m https://europe-west1-npm.pkg.dev/lovable-core-prod/sandbox-npm-cache/js-beautify\n\u001b[0m\u001b[32mDownload\u001b[0m https://europe-west1-npm.pkg.dev/lovable-core-prod/sandbox-npm-cache/react-promise-suspense\n\u001b[0m\u001b[32mDownload\u001b[0m https://europe-west1-npm.pkg.dev/lovable-core-prod/sandbox-npm-cache/@selderee%2fplugin-htmlparser2\n\u001b[0m\u001b[32mDownload\u001b[0m https://europe-west1-npm.pkg.dev/lovable-core-prod/sandbox-npm-cache/deepmerge\n\u001b[0m\u001b[32mDownload\u001b[0m https://europe-west1-npm.pkg.dev/lovable-core-prod/sandbox-npm-cache/dom-serializer\n\u001b[0m\u001b[32mDownload\u001b[0m https://europe-west1-npm.pkg.dev/lovable-core-prod/sandbox-npm-cache/htmlparser2\n\u001b[0m\u001b[32mDownload\u001b[0m https://europe-west1-npm.pkg.dev/lovable-core-prod/sandbox-npm-cache/selderee\n\u001b[0m\u001b[32mDownload\u001b[0m https://europe-west1-npm.pkg.dev/lovable-core-prod/sandbox-npm-cache/config-chain\n\u001b[0m\u001b[32mDownload\u001b[0m https://europe-west1-npm.pkg.dev/lovable-core-prod/sandbox-npm-cache/editorconfig\n\u001b[0m\u001b[32mDownload\u001b[0m https://europe-west1-npm.pkg.dev/lovable-core-prod/sandbox-npm-cache/glob\n\u001b[0m\u001b[32mDownload\u001b[0m https://europe-west1-npm.pkg.dev/lovable-core-prod/sandbox-npm-cache/js-cookie\n\u001b[0m\u001b[32mDownload\u001b[0m https://europe-west1-npm.pkg.dev/lovable-core-prod/sandbox-npm-cache/nopt\n\u001b[0m\u001b[32mDownload\u001b[0m https://europe-west1-npm.pkg.dev/lovable-core-prod/sandbox-npm-cache/domhandler\n\u001b[0m\u001b[32mDownload\u001b[0m https://europe-west1-npm.pkg.dev/lovable-core-prod/sandbox-npm-cache/domelementtype\n\u001b[0m\u001b[32mDownload\u001b[0m https://europe-west1-npm.pkg.dev/lovable-core-prod/sandbox-npm-cache/domutils\n\u001b[0m\u001b[32mDownload\u001b[0m https://europe-west1-npm.pkg.dev/lovable-core-prod/sandbox-npm-cache/parseley\n\u001b[0m\u001b[32mDownload\u001b[0m https://europe-west1-npm.pkg.dev/lovable-core-prod/sandbox-npm-cache/ini\n\u001b[0m\u001b[32mDownload\u001b[0m https://europe-west1-npm.pkg.dev/lovable-core-prod/sandbox-npm-cache/proto-list\n\u001b[0m\u001b[32mDownload\u001b[0m https://europe-west1-npm.pkg.dev/lovable-core-prod/sandbox-npm-cache/@one-ini%2fwasm\n\u001b[0m\u001b[32mDownload\u001b[0m https://europe-west1-npm.pkg.dev/lovable-core-prod/sandbox-npm-cache/foreground-child\n\u001b[0m\u001b[32mDownload\u001b[0m https://europe-west1-npm.pkg.dev/lovable-core-prod/sandbox-npm-cache/jackspeak\n\u001b[0m\u001b[32mDownload\u001b[0m https://europe-west1-npm.pkg.dev/lovable-core-prod/sandbox-npm-cache/minipass\n\u001b[0m\u001b[32mDownload\u001b[0m https://europe-west1-npm.pkg.dev/lovable-core-prod/sandbox-npm-cache/package-json-from-dist\n\u001b[0m\u001b[32mDownload\u001b[0m https://europe-west1-npm.pkg.dev/lovable-core-prod/sandbox-npm-cache/path-scurry\n\u001b[0m\u001b[32mDownload\u001b[0m https://europe-west1-npm.pkg.dev/lovable-core-prod/sandbox-npm-cache/abbrev\n\u001b[0m\u001b[32mDownload\u001b[0m https://europe-west1-npm.pkg.dev/lovable-core-prod/sandbox-npm-cache/leac\n\u001b[0m\u001b[32mDownload\u001b[0m https://europe-west1-npm.pkg.dev/lovable-core-prod/sandbox-npm-cache/peberminta\n\u001b[0m\u001b[32mDownload\u001b[0m https://europe-west1-npm.pkg.dev/lovable-core-prod/sandbox-npm-cache/signal-exit\n\u001b[0m\u001b[32mDownload\u001b[0m https://europe-west1-npm.pkg.dev/lovable-core-prod/sandbox-npm-cache/@isaacs%2fcliui\n\u001b[0m\u001b[32mDownload\u001b[0m https://europe-west1-npm.pkg.dev/lovable-core-prod/sandbox-npm-cache/@pkgjs%2fparseargs\n\u001b[0m\u001b[32mDownload\u001b[0m https://europe-west1-npm.pkg.dev/lovable-core-prod/sandbox-npm-cache/eastasianwidth\n\u001b[0m\u001b[32mDownload\u001b[0m https://europe-west1-npm.pkg.dev/lovable-core-prod/sandbox-npm-cache/@react-email/components/-/components-0.0.22.tgz\n\u001b[0m\u001b[32mDownload\u001b[0m https://europe-west1-npm.pkg.dev/lovable-core-prod/sandbox-npm-cache/@lovable.dev/mcp-js/-/mcp-js-0.22.2.tgz\n\u001b[0m\u001b[32mDownload\u001b[0m https://europe-west1-npm.pkg.dev/lovable-core-prod/sandbox-npm-cache/@lovable.dev/webhooks-js/-/webhooks-js-0.0.1.tgz\n\u001b[0m\u001b[32mDownload\u001b[0m https://europe-west1-npm.pkg.dev/lovable-core-prod/sandbox-npm-cache/@types/react/-/react-18.3.1.tgz\n\u001b[0m\u001b[32mDownload\u001b[0m https://europe-west1-npm.pkg.dev/lovable-core-prod/sandbox-npm-cache/@lovable.dev/email-js/-/email-js-0.1.2.tgz\n\u001b[0m\u001b[32mDownload\u001b[0m https://europe-west1-npm.pkg.dev/lovable-core-prod/sandbox-npm-cache/@react-email/link/-/link-0.0.9.tgz\n\u001b[0m\u001b[32mDownload\u001b[0m https://europe-west1-npm.pkg.dev/lovable-core-prod/sandbox-npm-cache/@react-email/text/-/text-0.0.9.tgz\n\u001b[0m\u001b[32mDownload\u001b[0m https://europe-west1-npm.pkg.dev/lovable-core-prod/sandbox-npm-cache/@react-email/render/-/render-0.0.17.tgz\n\u001b[0m\u001b[32mDownload\u001b[0m https://europe-west1-npm.pkg.dev/lovable-core-prod/sandbox-npm-cache/@react-email/markdown/-/markdown-0.0.11.tgz\n\u001b[0m\u001b[32mDownload\u001b[0m https://europe-west1-npm.pkg.dev/lovable-core-prod/sandbox-npm-cache/@react-email/row/-/row-0.0.9.tgz\n\u001b[0m\u001b[32mDownload\u001b[0m https://europe-west1-npm.pkg.dev/lovable-core-prod/sandbox-npm-cache/@react-email/button/-/button-0.0.16.tgz\n\u001b[0m\u001b[32mDownload\u001b[0m https://europe-west1-npm.pkg.dev/lovable-core-prod/sandbox-npm-cache/@react-email/code-inline/-/code-inline-0.0.3.tgz\n\u001b[0m\u001b[32mDownload\u001b[0m https://europe-west1-npm.pkg.dev/lovable-core-prod/sandbox-npm-cache/@react-email/container/-/container-0.0.13.tgz\n\u001b[0m\u001b[32mDownload\u001b[0m https://europe-west1-npm.pkg.dev/lovable-core-prod/sandbox-npm-cache/@react-email/column/-/column-0.0.11.tgz\n\u001b[0m\u001b[32mDownload\u001b[0m https://europe-west1-npm.pkg.dev/lovable-core-prod/sandbox-npm-cache/@react-email/font/-/font-0.0.7.tgz\n\u001b[0m\u001b[32mDownload\u001b[0m https://europe-west1-npm.pkg.dev/lovable-core-prod/sandbox-npm-cache/@react-email/heading/-/heading-0.0.13.tgz\n\u001b[0m\u001b[32mDownload\u001b[0m https://eur